/watch?v=jEoMM0B3SDE,"Véspera de Natal"
/watch?v=8qvbv4bzfQk,"A Subjetividade"
/watch?v=oMAew5zz6bg,"A história da máscara"
/watch?v=vrudo89kbg4,"A vontade Dele."
/watch?v=zy63IVFwU-I,"Isso precisa estar bem claro."
/watch?v=N57CwhbbxA8,"Ou tem sentido, ou não tem."
/watch?v=ZNRbflBHd2k,"Se"
/watch?v=wxhfjfb5tI8,"Como assim só eu existo?"
/watch?v=hlG-FP3z5gw,"Um reflexo"
/watch?v=A60iY4trp08,"το 'Αλφα και το Ωμέγα"
/watch?v=GYlBLL0gxrE,"O Imanifesto e seu reflexo."
/watch?v=qpPLfOmYMmI,"A solução para todos os problemas."
/watch?v=NTArw768ALk,"A torre."
/watch?v=XLKGVtvp0Mo,"E se"
/watch?v=KJ_NxE41C4c,"Mais do mesmo"
/watch?v=pFytp5-AgQA,"Basta que eu não conheça."
/watch?v=Qekt35F4mJ8,"E se você reduzisse todos os pensamentos até a raiz deles?"
/watch?v=ZaUA-Hm8VyM,"Como eu vou lidar com o mundo?"
/watch?v=TIZZhMbmzEw,"O resumo do resumo."
/watch?v=hf3ZDBjFv6g,"A extinção do buscador que nunca existiu."
/watch?v=EWDHfhxDuX0,"O Coração."
/watch?v=FzXsIjrKZzw,"O Silêncio."
/watch?v=nnwUl_OYASU,"A moldura"
/watch?v=pkhg8OjC0nA,"Por quê?"
/watch?v=7vrR77zIJHw,"Você"
/watch?v=j16RMgjoGzk,"De fora para dentro."
/watch?v=ng8lg8yk3OY,"eu-éclair"
/watch?v=yYWklvGgqCA,"Awareness - Atenção direcionada"
/watch?v=sslYWSDnPpQ,"Regra dos três."
/watch?v=11bsiBkbMuE,"Aquele eu que Eu sei que não sabe."
/watch?v=akfD_94pmFM,"Imagine."
/watch?v=YYgiW7nixJs,"Você é Brahman, a Realidade última."
/watch?v=UKUvYEiCGv0,"É só isso."
/watch?v=EpokrF5EBjo,"Eu não tenho nome"
/watch?v=WyN6Mmz2710,"Blá, blá, blá."
/watch?v=xVHr6vzLYFs,"Rendição é a ausência do rendido."
/watch?v=FndZsmeeo-0,"É uma pergunta sem resposta."
/watch?v=X3ZbasRw2vk,"Vai sair agora ou vai deixar para depois?"
/watch?v=s_imszkDdgQ,"Existente, Consciente e Bem-Aventurado."
/watch?v=NjOZIYvKKtY,"Quem assiste?"
/watch?v=prQElOFseSw,"Onde está o eu?"
/watch?v=PhsuVqUkDVU,"Ligeiramente diferente."
/watch?v=t8kRVGxeBqA,"Caixa de Luzes."
/watch?v=pVOSiqLUI3E,"0 e 1"
/watch?v=rc6w-8JJBeA,"Arquivo sem título."
/watch?v=E6bjciT7yNM,"Quando acordo, o corpo nem percebe."
/watch?v=NNrZJShH0yI,"Maya é incompreensível."
/watch?v=9u3rkJV0Lw0,"Onde tu não estás."
/watch?v=VvLVeGGthgI,"Absoluto."
/watch?v=-FT8qSkVSoE,"Eu não faço ideia de quem sou."
/watch?v=Jti10eClPEI,"O paraíso tem a aparência de alguém que não enxerga ele."
/watch?v=37FlTpflNH8,"Você é a resposta para todas as duvidas."
/watch?v=joR9RD9w25Q,"Dois mundos, uma aparência."
/watch?v=BYFcEFdJ7TM,"Anterior a mente."
/watch?v=QIJ6YCofIZk,"A felicidade."
/watch?v=GBEy8HFC78U,"Nunca houve um inicio."
/watch?v=TjYmgSYvznk,"A escada escondida."
/watch?v=fyk1JP9yIi4,"O ego e a resistência."
/watch?v=RTfVLx15YWY,"Cartas de amor."
/watch?v=UD61m55nd_Y,"Como pensar no estado sem pensamentos?"
/watch?v=Xa0HZCRqHAE,"O silêncio que precede tudo."
/watch?v=Y0UHOjtqptI,"A Realidade."
/watch?v=WT4X8NUxv9U,"O pecado original."
/watch?v=HrLCzSQI6O0,"De onde surgem os pensamentos e porque somos fisgados por eles?"
/watch?v=j-RUI5279Jc,"Derivações de pensamentos."
/watch?v=HU7tCps9MP4,"A corda no pescoço."
/watch?v=sIQ22UudHVY,"Meditação - Feche os olhos."
/watch?v=FMEjs6Tur0A,"Os Apontamentos Definitivos de Nisargadatta Maharaj - Legendado em Português."
/watch?v=aAXHjeFo5sY,"Os Apontamentos Definitivos de Nisargadatta Maharaj - Dublado em Português."
/watch?v=4usYjapqm5k,"Gênese Condicionada."
/watch?v=IN-iLaueu_4,"O ouro de tolo."
/watch?v=nWtdfeS3z7E,"Primeira, segunda e terceira pessoa."
/watch?v=lSSTMsKBlqw,"A incoerência e inutilidade dos meus vídeos."
/watch?v=Oc7BjWxPUn0,"Nada Sei."
/watch?v=SPaUtNSuzfw,"Um processo, várias faces."
/watch?v=Yq3o0DyVHLM,"Talvez você esteja observando seus pensamentos de maneira errada."
/watch?v=G-dJdBDx_pI,"Dois Degraus."
/watch?v=GjOqpCqY3Jk,"O Chão."
/watch?v=WvUuxpStWME,"Falando sobre o silêncio"
/watch?v=YEo43wwvt9s,"Você não faz parte de um clubinho especial."
/watch?v=N8LAlxVNxl4,"O inventor morreu antes de terminar a criação."
/watch?v=gW7pwxvkvxU,"A beleza da ignorância."
/watch?v=cR_gxJsMcPM,"A porta da entrada é a porta da saída."
/watch?v=98Mdngf6Mu8,"A importância de manter a mente quieta."
/watch?v=SyDfsYNqt6k,"Um palmo da face de Deus."
/watch?v=doGTEcTcIxY,"O Centro."
/watch?v=Q2w-1h9DPLA,"Vamos brincar de supor."
/watch?v=XqlTSiZYYV4,"Midnight Gospel e as orelhas do coração."
/watch?v=ZLrijWz1oSU,"Convite ao infinito."
/watch?v=3fGD61T45-I,"Os termos usados para indicar a realidade não são a realidade."
/watch?v=W7LuqNoRflo,"Não basta saber o que não é. É necessário saber o que é."
/watch?v=p1QrGsiA0wg,"A Lua"
/watch?v=EaHi31Fg77Y,"Não faltam dois passos. Você passou dois passos."
/watch?v=I8lU5VM-cbg,"Porque você quer despertar?"
/watch?v=FKBTBXs_h9A,"Aquilo que conhece, não pode ser conhecido."
/watch?v=mv-7wMCQs-Y,"Só você existe, mesmo que sejam dois vocês."
/watch?v=6zZOac03SnE,"A lampada e a sombra."
/watch?v=-NgOmRuoRZw,"A origem do conflito."
/watch?v=q8CoaqmazP4,"Sobre o final da busca."
/watch?v=Zgk35Q3EQyo,"Quem observa o que?"
/watch?v=gL-Y7omVKGQ,"Três motivos pelos quais você se sente estagnado no seu progresso."
/watch?v=l49rvxRhuUI,"Existir ou não existir, o que te preocupa de verdade?"
/watch?v=yAGSQkrCdKA,"Só é possível pensar sobre o que não é."
/watch?v=8S4Av9DEIeU,"Afirmações absurdas de um estado absurdo."
/watch?v=Von_K-hSizs,"Infinito pra dentro, não pra fora."
/watch?v=h3db6Rf6TAM,"Como lidar com a oscilação?"
/watch?v=Dk_ApDqNohc,"Para entender a oscilação, precisamos entender entre o que estamos oscilando."
/watch?v=bieb6x89SdA,"A oscilação entre Realidade e ilusão."
/watch?v=SzBZVvF4V0g,"E quando José precisa descobrir que José não existe?"
/watch?v=ehaE6YCrgZU,"Quem vigia o vigilante?"
/watch?v=7BOFk-Tj1IY,"Nem dentro, Nem fora."
/watch?v=x-X0RKmyFlk,"Como observar o seu interior ao invés do exterior."
/watch?v=oMwgcil10A8,"O efeito bumerangue."
/watch?v=A6N2XR0tDto,"Se eu não sou o corpo e a mente, o que eu sou?"
/watch?v=yiBE8xj5s1E,"Além da borda, tudo o que existe é imaginação."
/watch?v=MN8v8PxPI2Q,"O gerenciador de tarefas da sua mente."
/watch?v=ncUrYWvCnzA,"O que a mente reflete, ela projeta."
/watch?v=owE3LJncBCM,"A mente reflete, mas não é o Eu."
/watch?v=UgMgsflLTAQ,"Ashtavakra Gita - Completo: A canção de Ashtavakra"
/watch?v=2P2wgpvhrBA,"Ashtavakra Gita: 20 - A Libertação em Vida"
/watch?v=LQe2MU0tNIA,"Ashtavakra Gita: 19 - O Repouso no Eu"
/watch?v=m_fF-Lmc-us,"Ashtavakra Gita: 17 - O Verdadeiro Conhecedor"
/watch?v=Gctf5I6DoWo,"Ashtavakra Gita: 16 - Instrução Especial"
/watch?v=o3x3m3Eby6U,"Como parar de desejar se o desejo nunca acaba?"
/watch?v=Ur77Sq1K9lw,"Peraí, falta resolver só mais essa área da minha vida."
/watch?v=Bx0qcjl2kn0,"Os cinco Koshas e as camadas da falsa identificação."
/watch?v=TijymtXsHgc,"Especial Dicas de Filmes - 1"
/watch?v=YWbcJjbHR9A,"A instrução é pro Divino, o humano pega de tabela."
/watch?v=E9swfas0Wlw,"Esse será o último vídeo do canal."
/watch?v=1097zT_mooE,"Ashtavakra Gita: 15 - O Conhecimento do Eu"
/watch?v=Ozbe_poC6AA,"Ashtavakra Gita: 14 - Tranquilidade"
/watch?v=TwYONPWNe5Y,"Ashtavakra Gita: 13 - Felicidade"
/watch?v=NCU64Ueh7ck,"Ashtavakra Gita: 12 - Permanecendo no Eu"
/watch?v=JouUNyVF950,"Ashtavakra Gita: 11 - Sabedoria"
/watch?v=wHMwvvKwpxA,"O maior paradoxo: Você perdoa Deus?"
/watch?v=jz7VyS6g0Uo,"O paradoxo da unidade e a existência de outros."
/watch?v=5wNZgWW12mU,"O que significa repousar no eu?"
/watch?v=5PxQRUuY4WU,"Ashtavakra Gita: 10 - Quietude"
/watch?v=brfMXW3RLaQ,"Ashtavakra Gita: 9 - Desapego"
/watch?v=HLkQap8usM0,"Ashtavakra Gita: 8 - Escravidão e Libertação."
/watch?v=PEeW7_JOm8E,"Ashtavakra Gita: 7 - A Natureza da Autorrealização"
/watch?v=4-3zK2yhLWI,"Ashtavakra Gita: 6 - O Maior Conhecimento"
/watch?v=egY1bw6sjjs,"Ashtavakra Gita: 5 - Os Quatro Caminhos para a Dissolução"
/watch?v=o6zv6fXX_R4,"Ashtavakra Gita: 4 - A Glorificação da Autorrealização"
/watch?v=PUNWU8K8C6s,"Como dois estados diferentes existem sobrepostos?"
/watch?v=uWbaFHffv1w,"Ashtavakra Gita: 3 - O Teste de Autorrealização"
/watch?v=BXAhqvMcaZU,"Seja bem vindo."
/watch?v=f6wHkr4TOuc,"Ashtavakra Gita: 2 - A Alegria da Autorrealização"
/watch?v=US762cnh17Q,"Ashtavakra Gita: 1 - Instrução sobre Autorrealização"
/watch?v=4aW7VH_V2KE,"Sobre o perdão."
/watch?v=6jrtMq4-tog,"Sobre a inexistência de reencarnações."
/watch?v=5bMTDhnonfo,"Não é só presente, é presente pra caramba!"
/watch?v=9faeT-gAaJs,"Quem veio primeiro? Samsara ou nirvana?"
/watch?v=6MglvpGl65Y,"Por que não é possível expressar a Realidade de maneira direta?"
/watch?v=IvTpOoD8oyk,"Subestimar Brahman atrapalha seu entendimento."
/watch?v=zs5XUjCfdtk,"O mundo é irreal e real ao mesmo tempo."
/watch?v=WZT1Raxyo1I,"O Objeto observado, o Observador e a Observação."
/watch?v=zCXIvUEjqvE,"Paradoxos e Contradições do advaita 3: O conhecimento."
/watch?v=eDoEcthqgws,"Paradoxos e Contradições do advaita 2: A graça."
/watch?v=dvx9TCGR1DM,"Paradoxos e Contradições do advaita 1: Livre-arbítrio."
/watch?v=T4RFQip0TtY,"Paradoxos e Contradições do advaita: Série de vídeos."
/watch?v=-Af28OX85gI,"Tudo Sobre Nada: Legendado em português."
/watch?v=C0KlthFwvy8,"O Eu é a maior coisa que existe."
/watch?v=_ktDk_CsOaw,"Aprenda a ficar milionário vivendo na oitava dimensão!"
/watch?v=7w-QJW-ovAQ,"Esse negócio de tempo é coisa da sua cabeça."
/watch?v=vjtKQTZd-8s,"Venkataraman: Bhagavan Sri Ramana Maharshi"
/watch?v=dG-p5lRZ03c,"Se tudo é um, tudo está certo!"
/watch?v=mjs7wbHl1Uw,"Se você não existe, ninguém existe"
/watch?v=Wh-TGaXDd5s,"A importância do estado de equanimidade."
/watch?v=wMTe73F8k4Y,"Qual a essência do eu físico?"
/watch?v=mAPvAOqp6YA,"Nisargadatta Maharaj - Eu sou anterior a tudo"
/watch?v=lQ-E1uZyDSw,"Entendendo o conceito de vazio: O Ser não tem atributos"
/watch?v=UABaeO0Rg3w,"Frases de Nisargadatta Maharaj - Leitura de trechos do livro &quot,Eu sou Aquilo&quot,"
/watch?v=Onkbo-eCk04,"A canção do Avadhuta - Leitura de trecho do livro."
/watch?v=2_W29WFUBC0,"Bardo Thodol e a visão psicodélica"
/watch?v=-QK7KlIwnB0,"Bardo Thodol - O Livro Tibetano dos Mortos"
/watch?v=MZemwyE41k4,"O Karma e a dualidade"
/watch?v=IbKTkB_iC4A,"Você é Brahman"
/watch?v=QJ4itCJwlSM,"Sobre o Livre-arbítrio, Brahman e o eu."
/watch?v=8WVW1BgDc48,"O Eu, a consciência e a impermanência."
/watch?v=isfmpxdnrSY,"Trimurti - Brahma, Vishnu e Shiva"
/watch?v=xwxhPHzodgk,"A tela em branco"
/watch?v=AlN6raQBev8,"Três Amigos - Legendado em Português"
/watch?v=HYYtaWAplHA,"Sua tela de percepção da vida"
/watch?v=TCSDZlCq4Kg,"Você é produto do Universo ou o Universo é produto de você?"
/watch?v=V3DYTKMeh08,"O universo só existe porque você existe"
/watch?v=lJ7Uqk8KQWM,"Os três estados de existencia e o Turya"
/watch?v=V6xmSj6pGoo,"Quem está dirigindo o onibus dos sonhos?"
/watch?v=-g9AJn5sBl0,"Este corpo morto não pertence a você - Ramakant Maharaj"
/watch?v=vS4-USdbcDk,"Swami Vivekananda - O Filme - 2012 - Legendado em Português"
/watch?v=lcpdQ2QVeZw,"Você sempre existiu"
/watch?v=vDj2_gigvNU,"Yoga -  Criação, tattvas, vayus, koshas, gunas, chakras e nadis."
/watch?v=zls_s7_MWwU,"DMT - Experimentando o impossível"
/watch?v=k85oBoUceh8,"Paul Stamets - Cogumelos Mágicos e uma mudança profunda de vida"
/watch?v=ulw_PRKrui8,"A vida é só um sonho!"
/watch?v=9I1Ib9bI-nc,"Sadhguru - Revela o segredo do seu conhecimento - Mantra Shiva Shambho - Legendado em português"
/watch?v=cE1kRwVWb8o,"Sadhguru TED Talks - Legendado em Portugues"
/watch?v=Gu3TH8ZQAq8,"O Acordar: Relatos de Iluminação - Mooji - Legendado"
/watch?v=I-7ma6URCCg,"What really exists - Jim Carrey - Legendado (O que Realmente Existe)"